{
  "checkpoints": [
    {
      "case": "issues/occt-544/1/public/reproduce.tcl",
      "category": "original",
      "id": "visible_issue_544",
      "issue_id": "occt-544",
      "oracle": "draw_test_done_v1",
      "required": true,
      "runner": "draw_case_v1",
      "runner_options": {
        "case_timeout_seconds": 18
      },
      "timeout_seconds": 30,
      "visibility": "public"
    },
    {
      "case": "issues/occt-506/1/public/reproduce.cpp",
      "category": "original",
      "id": "visible_issue_506_hole0",
      "issue_id": "occt-506",
      "oracle": "stdout_contains_v1",
      "required": true,
      "runner": "cpp_case_v1",
      "runner_options": {
        "case_timeout_seconds": 15,
        "inputs": [
          "issues/occt-506/1/public/brd.brep",
          "issues/occt-506/1/public/hole0.brep"
        ],
        "libraries": [
          "TKTopAlgo",
          "TKBRep",
          "TKMath",
          "TKernel",
          "TKG3d",
          "TKGeomBase"
        ],
        "stdout_contains": [
          "indices.Size(): 1",
          "Index 0"
        ]
      },
      "timeout_seconds": 30,
      "visibility": "public"
    },
    {
      "case": "issues/occt-506/1/public/reproduce.cpp",
      "category": "original",
      "id": "visible_issue_506_hole1",
      "issue_id": "occt-506",
      "oracle": "stdout_contains_v1",
      "required": true,
      "runner": "cpp_case_v1",
      "runner_options": {
        "case_timeout_seconds": 15,
        "inputs": [
          "issues/occt-506/1/public/brd.brep",
          "issues/occt-506/1/public/hole1.brep"
        ],
        "libraries": [
          "TKTopAlgo",
          "TKBRep",
          "TKMath",
          "TKernel",
          "TKG3d",
          "TKGeomBase"
        ],
        "stdout_contains": [
          "indices.Size(): 1",
          "Index 0"
        ]
      },
      "timeout_seconds": 30,
      "visibility": "public"
    },
    {
      "case": "issues/occt-847/1/public/reproduce.tcl",
      "category": "original",
      "id": "visible_issue_847",
      "issue_id": "occt-847",
      "oracle": "draw_test_done_v1",
      "required": true,
      "runner": "draw_case_v1",
      "runner_options": {
        "case_timeout_seconds": 18
      },
      "timeout_seconds": 30,
      "visibility": "public"
    }
  ],
  "group_ids": [
    "occt_boolean_group_visible_544_506_847"
  ],
  "id": "occt-visible3",
  "legacy_task_kind": "visible3",
  "schema_version": 1,
  "source_ids": [
    "occt-3e80fad1779e"
  ],
  "title": "OCCT visible3 legacy checks",
  "version": "1"
}
