{
  "schema_version": 1,
  "id": "occt-boolean-intersection-v4-mantis-31470",
  "version": "1",
  "title": "OCCT · 31470 · 检查点",
  "source_ids": [
    "occt-v4-bdeea0a89759"
  ],
  "group_ids": [
    "occt-boolean-intersection-v4-mantis-31470"
  ],
  "checkpoints": [
    {
      "id": "original-31470-upstream",
      "issue_id": "mantis-31470",
      "category": "original",
      "visibility": "hidden",
      "runner": "draw_case_v1",
      "case": "issues/occt-31470/1/original_official.tcl",
      "oracle": "draw_test_done_v1",
      "timeout_seconds": 180,
      "required": true,
      "runner_options": {
        "case_timeout_seconds": 180
      }
    },
    {
      "id": "neighborhood-31470-1-official-shell-rigid-z",
      "issue_id": "mantis-31470",
      "category": "neighborhood",
      "visibility": "hidden",
      "runner": "draw_case_v1",
      "case": "issues/occt-31470/1/neighborhood_1_official_shell_rigid_z.tcl",
      "oracle": "draw_test_done_v1",
      "timeout_seconds": 180,
      "required": true,
      "runner_options": {
        "case_timeout_seconds": 180
      }
    },
    {
      "id": "neighborhood-31470-2-official-shell-rigid-x",
      "issue_id": "mantis-31470",
      "category": "neighborhood",
      "visibility": "hidden",
      "runner": "draw_case_v1",
      "case": "issues/occt-31470/1/neighborhood_2_official_shell_rigid_x.tcl",
      "oracle": "draw_test_done_v1",
      "timeout_seconds": 180,
      "required": true,
      "runner_options": {
        "case_timeout_seconds": 180
      }
    },
    {
      "id": "regression-31470-contained-shell",
      "issue_id": "mantis-31470",
      "category": "regression",
      "visibility": "hidden",
      "runner": "draw_case_v1",
      "case": "issues/occt-31470/1/regression_health_contained_shell.tcl",
      "oracle": "draw_test_done_v1",
      "timeout_seconds": 180,
      "required": true,
      "runner_options": {
        "case_timeout_seconds": 180
      }
    }
  ],
  "support_files": [
    "issues/occt-31470/1/bootstrap.tcl",
    "issues/occt-31470/1/official_upstream.tcl",
    "issues/occt-31470/1/original_official.tcl",
    "issues/occt-31470/1/neighborhood_1_official_shell_rigid_z.tcl",
    "issues/occt-31470/1/neighborhood_2_official_shell_rigid_x.tcl",
    "issues/occt-31470/1/regression_health_contained_shell.tcl"
  ]
}
